<?xml version="1.0" encoding="UTF-8"?>
<!ELEMENT ganadores (ganador+)> 

<!ELEMENT ganador (nombre, numVictorias)>

<!ELEMENT nombre (#PCDATA)>
<!ELEMENT numVictorias (#PCDATA)>